Asset_ID,Property_Address,City,State,Zip_Code,Investor_Name,Investment_Amount,Ownership_Percentage,Investment_Date,Property_Type,Purchase_Price,Current_Market_Value,Bedrooms,Bathrooms,Square_Footage,Listing_Status,Listing_Price,Days_on_Market,Marketing_Strategy,Monthly_Rental_Income,Expected_ROI,Property_Manager,Insurance_Annual_Premium,Property_Tax_Annual,General_Notes
PROP001,Villa 123 Lakes District New Cairo,New Cairo,Cairo,11835,Eng. Mostafa Al-Qadi,4800000,100%,2022-03-15,Single Family Villa,4800000,5200000,4,3,450,Not Listed,0,0,N/A,80000,8.33%,Crystal Power Management,45000,72000,Premium villa with pool and garden in gated community
PROP002,Apartment 45B Palm Hills Sheikh Zayed,Sheikh Zayed,Giza,12588,Eng. Mostafa Al-Qadi,2200000,100%,2021-06-20,Apartment,2200000,2500000,3,2,180,Listed,2650000,45,Online & Broker,45000,13.64%,Palm Hills Property Mgmt,18000,33000,Modern apartment with compound amenities
PROP003,Villa 78 Narges District Nasr City,Nasr City,Cairo,11371,Mohamed Maisara,5500000,100%,2020-09-10,Villa,5500000,6300000,5,4,520,Not Listed,0,0,N/A,90000,14.55%,Nasr City Realty,52000,82500,Spacious family villa near schools and shopping
PROP004,Townhouse 12 6th October Gardens,6th October,Giza,12573,Mohamed Maisara,3200000,100%,2021-11-25,Townhouse,3200000,3500000,4,3,280,Listed,3750000,30,Social Media & Broker,50000,9.38%,October Property Services,28000,48000,Modern townhouse with private garden
PROP005,Apartment 301 Street 9 Maadi,Maadi,Cairo,11728,Abdelmohsen Group,2800000,100%,2022-01-18,Apartment,2800000,3000000,3,2,200,Listed,3200000,15,Premium Broker Network,55000,7.14%,Maadi Premium Management,22000,42000,Prime location near metro and amenities
PROP006,Villa 456 Green District NAC,New Administrative Capital,Cairo,11835,Abdelmohsen Group,12000000,100%,2024-01-05,Villa,12000000,12000000,6,5,800,Not Listed,0,0,N/A,0,0.00%,NAC Elite Properties,95000,180000,Newly acquired luxury villa in the Green District
